{
  "$schema": "https://json-schema.org/draft/2020-12/schema",
  "$id": "https://lstepnio.github.io/ESP32OBD2/contracts/config.schema.json",
  "type": "object",
  "properties": {
    "schemaVersion": {
      "enum": [
        1,
        2
      ]
    },
    "baseRevision": {
      "type": "integer",
      "minimum": 0,
      "maximum": 4294967295
    },
    "vehicleProfileId": {
      "type": "string",
      "minLength": 1,
      "maxLength": 64,
      "pattern": "^[a-z][a-z0-9._-]*$"
    },
    "units": {
      "enum": [
        "metric",
        "imperial"
      ]
    },
    "rotation": {
      "enum": [
        0,
        90,
        180,
        270
      ]
    },
    "brightness": {
      "type": "integer",
      "minimum": 5,
      "maximum": 100
    },
    "reducedMotion": {
      "type": "boolean"
    },
    "definitions": {
      "type": "array",
      "items": {
        "$ref": "pid-definition.schema.json"
      },
      "minItems": 1,
      "maxItems": 32
    },
    "pages": {
      "type": "array",
      "items": {
        "type": "object",
        "properties": {
          "id": {
            "type": "string",
            "minLength": 1,
            "maxLength": 64,
            "pattern": "^[a-z][a-z0-9._-]*$"
          },
          "name": {
            "type": "string",
            "minLength": 1,
            "maxLength": 32
          },
          "renderer": {
            "enum": [
              "numeric",
              "arc",
              "bar",
              "trend",
              "dual",
              "dualArc"
            ]
          },
          "pidIds": {
            "type": "array",
            "items": {
              "type": "string",
              "minLength": 1,
              "maxLength": 64,
              "pattern": "^[a-z][a-z0-9._-]*$"
            },
            "minItems": 1,
            "maxItems": 2,
            "uniqueItems": true
          },
          "arcMetricIndex": {
            "type": "integer",
            "minimum": 0,
            "maximum": 1
          }
        },
        "required": [
          "id",
          "name",
          "renderer",
          "pidIds"
        ],
        "additionalProperties": false,
        "allOf": [
          {
            "if": {
              "properties": {
                "renderer": {
                  "const": "dualArc"
                }
              }
            },
            "then": {
              "required": [
                "arcMetricIndex"
              ],
              "properties": {
                "pidIds": {
                  "minItems": 2,
                  "maxItems": 2
                }
              }
            },
            "else": {
              "not": {
                "required": [
                  "arcMetricIndex"
                ]
              }
            }
          }
        ]
      },
      "minItems": 1,
      "maxItems": 10
    },
    "alerts": {
      "type": "array",
      "items": {
        "type": "object",
        "properties": {
          "id": {
            "type": "string",
            "minLength": 1,
            "maxLength": 64,
            "pattern": "^[a-z][a-z0-9._-]*$"
          },
          "pidId": {
            "type": "string",
            "minLength": 1,
            "maxLength": 64,
            "pattern": "^[a-z][a-z0-9._-]*$"
          },
          "direction": {
            "enum": [
              "above",
              "below",
              "equals"
            ]
          },
          "warning": {
            "type": "number",
            "minimum": -1000000000000.0,
            "maximum": 1000000000000.0
          },
          "critical": {
            "type": "number",
            "minimum": -1000000000000.0,
            "maximum": 1000000000000.0
          },
          "hysteresis": {
            "type": "number",
            "minimum": 0,
            "maximum": 1000000000.0
          },
          "triggerDwellMs": {
            "type": "integer",
            "minimum": 0,
            "maximum": 60000
          },
          "clearDwellMs": {
            "type": "integer",
            "minimum": 0,
            "maximum": 60000
          },
          "snoozeMs": {
            "type": "integer",
            "minimum": 0,
            "maximum": 600000
          },
          "priority": {
            "type": "integer",
            "minimum": 0,
            "maximum": 10
          }
        },
        "required": [
          "id",
          "pidId",
          "direction",
          "hysteresis",
          "triggerDwellMs",
          "clearDwellMs",
          "snoozeMs",
          "priority"
        ],
        "additionalProperties": false,
        "anyOf": [
          {
            "required": [
              "warning"
            ]
          },
          {
            "required": [
              "critical"
            ]
          }
        ]
      },
      "minItems": 0,
      "maxItems": 32
    },
    "sources": {
      "type": "array",
      "minItems": 1,
      "maxItems": 2,
      "items": {
        "type": "object",
        "additionalProperties": false,
        "required": [
          "id",
          "label",
          "role"
        ],
        "properties": {
          "id": {
            "type": "string",
            "minLength": 1,
            "maxLength": 32,
            "pattern": "^[a-z][a-z0-9._-]*$"
          },
          "label": {
            "type": "string",
            "minLength": 1,
            "maxLength": 32
          },
          "role": {
            "enum": [
              "ecm",
              "tcm",
              "other"
            ]
          },
          "adapter": {
            "type": "object",
            "properties": {
              "id": {
                "type": "string",
                "pattern": "^[a-z][a-z0-9._-]*$",
                "minLength": 1,
                "maxLength": 64
              },
              "address": {
                "type": "string",
                "pattern": "^[0-9A-F]{2}(:[0-9A-F]{2}){5}$"
              },
              "addressType": {
                "enum": [
                  "public",
                  "random"
                ]
              },
              "driver": {
                "enum": [
                  "elm-18f0-v1",
                  "elm-bench-v1"
                ]
              }
            },
            "required": [
              "id",
              "address",
              "addressType",
              "driver"
            ],
            "additionalProperties": false
          }
        }
      }
    },
    "actions": {
      "type": "array",
      "maxItems": 1,
      "items": {
        "type": "object",
        "properties": {
          "type": {
            "enum": [
              "jumpPage",
              "vehicleActions"
            ]
          },
          "pageId": {
            "type": "string",
            "pattern": "^[a-z][a-z0-9._-]{0,63}$"
          },
          "gesture": {
            "const": "up"
          },
          "count": {
            "type": "integer",
            "minimum": 2,
            "maximum": 5
          },
          "windowMs": {
            "type": "integer",
            "minimum": 2000,
            "maximum": 10000,
            "multipleOf": 1000
          },
          "airUpSeconds": {
            "type": "integer",
            "minimum": 10,
            "maximum": 600
          },
          "winchSeconds": {
            "type": "integer",
            "minimum": 10,
            "maximum": 600
          },
          "pages": {
            "type": "array",
            "maxItems": 3,
            "uniqueItems": true,
            "items": {
              "enum": [
                "airUp",
                "winch",
                "absTcs"
              ]
            }
          }
        },
        "required": [
          "type",
          "gesture",
          "count",
          "windowMs"
        ],
        "additionalProperties": false,
        "allOf": [
          {
            "if": {
              "properties": {
                "type": {
                  "const": "jumpPage"
                }
              }
            },
            "then": {
              "required": [
                "pageId"
              ],
              "properties": {
                "airUpSeconds": false,
                "winchSeconds": false,
                "pages": false
              }
            },
            "else": {
              "required": [
                "airUpSeconds",
                "winchSeconds"
              ],
              "properties": {
                "pageId": false
              }
            }
          }
        ]
      }
    },
    "diagnosticFilters": {
      "type": "array",
      "maxItems": 16,
      "uniqueItems": true,
      "items": {
        "type": "object",
        "properties": {
          "controller": {
            "enum": [
              "ecm",
              "tcm"
            ]
          },
          "code": {
            "type": "string",
            "pattern": "^[PCBU][0-3][0-9A-F]{3}$",
            "not": {
              "const": "P0000"
            }
          }
        },
        "required": [
          "controller",
          "code"
        ],
        "additionalProperties": false
      }
    }
  },
  "required": [
    "schemaVersion",
    "baseRevision",
    "vehicleProfileId",
    "units",
    "rotation",
    "brightness",
    "reducedMotion",
    "definitions",
    "pages",
    "alerts",
    "sources"
  ],
  "additionalProperties": false,
  "allOf": [
    {
      "if": {
        "properties": {
          "schemaVersion": {
            "const": 1
          }
        }
      },
      "then": {
        "properties": {
          "sources": {
            "items": {
              "not": {
                "required": [
                  "adapter"
                ]
              }
            }
          },
          "actions": false
        }
      }
    },
    {
      "if": {
        "required": [
          "diagnosticFilters"
        ]
      },
      "then": {
        "properties": {
          "schemaVersion": {
            "const": 2
          }
        }
      }
    }
  ]
}
