{
  "schemaVersion": 2,
  "baseRevision": 0,
  "vehicleProfileId": "example.vehicle",
  "units": "metric",
  "rotation": 0,
  "brightness": 80,
  "reducedMotion": false,
  "definitions": [
    {
      "schemaVersion": 1,
      "id": "engine.rpm",
      "revision": 1,
      "name": "Engine RPM",
      "unit": "rpm",
      "request": {
        "service": "01",
        "identifier": "0C",
        "route": "functional",
        "responseId": "7E8"
      },
      "response": {
        "prefix": "410C",
        "minPayloadBytes": 2
      },
      "decoder": {
        "byteOffset": 0,
        "byteLength": 2,
        "endian": "big",
        "signed": false,
        "numerator": 1,
        "denominator": 4,
        "offset": 0
      },
      "range": {
        "min": 0,
        "max": 16383.75
      },
      "pollIntervalMs": 500,
      "staleAfterMs": 2000,
      "provenance": {
        "source": "Standard OBD-II numeric example; sample is synthetic",
        "license": "Project-authored example",
        "vehicleScope": "Example CAN ECU 7E8 only; discover actual responder",
        "evidence": "synthetic"
      },
      "vectors": [
        {
          "payloadHex": "1AF8",
          "expected": 1726
        }
      ],
      "sourceId": "ecm"
    },
    {
      "schemaVersion": 1,
      "id": "engine.coolant",
      "revision": 1,
      "name": "Coolant temperature",
      "unit": "degC",
      "request": {
        "service": "01",
        "identifier": "05",
        "route": "functional",
        "responseId": "7E8"
      },
      "response": {
        "prefix": "4105",
        "minPayloadBytes": 1
      },
      "decoder": {
        "byteOffset": 0,
        "byteLength": 1,
        "endian": "big",
        "signed": false,
        "numerator": 1,
        "denominator": 1,
        "offset": -40
      },
      "range": {
        "min": -40,
        "max": 215
      },
      "pollIntervalMs": 500,
      "staleAfterMs": 2000,
      "provenance": {
        "source": "Standard OBD-II numeric example; sample is synthetic",
        "license": "Project-authored example",
        "vehicleScope": "Example CAN ECU 7E8 only; discover actual responder",
        "evidence": "synthetic"
      },
      "vectors": [
        {
          "payloadHex": "7B",
          "expected": 83
        }
      ],
      "sourceId": "ecm"
    },
    {
      "schemaVersion": 1,
      "id": "vehicle.speed",
      "revision": 1,
      "name": "Vehicle speed",
      "unit": "kph",
      "request": {
        "service": "01",
        "identifier": "0D",
        "route": "functional",
        "responseId": "7E8"
      },
      "response": {
        "prefix": "410D",
        "minPayloadBytes": 1
      },
      "decoder": {
        "byteOffset": 0,
        "byteLength": 1,
        "endian": "big",
        "signed": false,
        "numerator": 1,
        "denominator": 1,
        "offset": 0
      },
      "range": {
        "min": 0,
        "max": 255
      },
      "pollIntervalMs": 500,
      "staleAfterMs": 2000,
      "provenance": {
        "source": "Standard OBD-II numeric example; sample is synthetic",
        "license": "Project-authored example",
        "vehicleScope": "Example CAN ECU 7E8 only; discover actual responder",
        "evidence": "synthetic"
      },
      "vectors": [
        {
          "payloadHex": "32",
          "expected": 50
        }
      ],
      "sourceId": "ecm"
    },
    {
      "schemaVersion": 1,
      "id": "engine.load",
      "revision": 1,
      "name": "Calculated load",
      "unit": "%",
      "request": {
        "service": "01",
        "identifier": "04",
        "route": "functional",
        "responseId": "7E8"
      },
      "response": {
        "prefix": "4104",
        "minPayloadBytes": 1
      },
      "decoder": {
        "byteOffset": 0,
        "byteLength": 1,
        "endian": "big",
        "signed": false,
        "numerator": 100,
        "denominator": 255,
        "offset": 0
      },
      "range": {
        "min": 0,
        "max": 100
      },
      "pollIntervalMs": 500,
      "staleAfterMs": 2000,
      "provenance": {
        "source": "Standard OBD-II numeric example; sample is synthetic",
        "license": "Project-authored example",
        "vehicleScope": "Example CAN ECU 7E8 only; discover actual responder",
        "evidence": "synthetic"
      },
      "vectors": [
        {
          "payloadHex": "FF",
          "expected": 100
        }
      ],
      "sourceId": "ecm"
    },
    {
      "schemaVersion": 1,
      "id": "vehicle.fuel",
      "revision": 1,
      "name": "Fuel level",
      "unit": "%",
      "request": {
        "service": "01",
        "identifier": "2F",
        "route": "functional",
        "responseId": "7E8"
      },
      "response": {
        "prefix": "412F",
        "minPayloadBytes": 1
      },
      "decoder": {
        "byteOffset": 0,
        "byteLength": 1,
        "endian": "big",
        "signed": false,
        "numerator": 100,
        "denominator": 255,
        "offset": 0
      },
      "range": {
        "min": 0,
        "max": 100
      },
      "pollIntervalMs": 500,
      "staleAfterMs": 2000,
      "provenance": {
        "source": "Standard OBD-II numeric example; sample is synthetic",
        "license": "Project-authored example",
        "vehicleScope": "Example CAN ECU 7E8 only; discover actual responder",
        "evidence": "synthetic"
      },
      "vectors": [
        {
          "payloadHex": "FF",
          "expected": 100
        }
      ],
      "sourceId": "ecm"
    }
  ],
  "pages": [
    {
      "id": "page.1",
      "name": "Page 1",
      "renderer": "numeric",
      "pidIds": [
        "engine.rpm"
      ]
    },
    {
      "id": "page.2",
      "name": "Page 2",
      "renderer": "numeric",
      "pidIds": [
        "engine.rpm"
      ]
    },
    {
      "id": "page.3",
      "name": "Page 3",
      "renderer": "numeric",
      "pidIds": [
        "engine.rpm"
      ]
    },
    {
      "id": "page.4",
      "name": "Page 4",
      "renderer": "numeric",
      "pidIds": [
        "engine.rpm"
      ]
    },
    {
      "id": "page.5",
      "name": "Page 5",
      "renderer": "numeric",
      "pidIds": [
        "engine.rpm"
      ]
    },
    {
      "id": "page.6",
      "name": "Page 6",
      "renderer": "numeric",
      "pidIds": [
        "engine.rpm"
      ]
    },
    {
      "id": "page.7",
      "name": "Page 7",
      "renderer": "numeric",
      "pidIds": [
        "engine.rpm"
      ]
    },
    {
      "id": "page.8",
      "name": "Page 8",
      "renderer": "numeric",
      "pidIds": [
        "engine.rpm"
      ]
    },
    {
      "id": "page.9",
      "name": "Page 9",
      "renderer": "numeric",
      "pidIds": [
        "engine.rpm"
      ]
    },
    {
      "id": "page.dual-arc",
      "name": "RPM and coolant",
      "renderer": "dualArc",
      "pidIds": [
        "engine.rpm",
        "engine.coolant"
      ],
      "arcMetricIndex": 1
    }
  ],
  "alerts": [
    {
      "id": "alert.coolant",
      "pidId": "engine.coolant",
      "direction": "above",
      "warning": 105,
      "critical": 115,
      "hysteresis": 3,
      "triggerDwellMs": 2000,
      "clearDwellMs": 5000,
      "snoozeMs": 0,
      "priority": 8
    }
  ],
  "sources": [
    {
      "id": "ecm",
      "label": "Engine adapter",
      "role": "ecm",
      "adapter": {
        "id": "adapter-fixture",
        "address": "C0:00:00:00:00:01",
        "addressType": "random",
        "driver": "elm-18f0-v1"
      }
    }
  ]
}
